id,emergency_name,emergency_status,emergency_glide,emergency_go_id,emergency_location_id,emergency_review_id,activation_details,slack_channel,dropbox_url,trello_url,emergency_type_id,created_at,updated_at
1,Canada Wildfires,Active,2123,132,42,NULL,A massive wildfire broke out in Alberta. SIMS was requested for remote mapping support.,,,,15,2022-05-04 15:03:21,2022-06-29 18:04:06
2,Indonesia Floods,Active,123331,1443,85,NULL,We were asked to support some mapping related to the floods.,NULL,NULL,NULL,12,2022-05-04 15:03:21,NULL
3,Haiti Earthquake,Active,1234,3,80,NULL,"Bad earthquake, we came to map it.",NULL,NULL,NULL,2,2022-05-04 15:03:21,NULL
4,Ukraine Crisis,Active,123,5854,1,NULL,"After Russian forces invaded in late February, SIMS was activated to provide remote and deployed support. ",C0353KEK13L,https://www.dropbox.com/sh/4x1i0e6zbxx36ej/AAC56JtnSkeT878jbucWBvcka?dl=0,https://trello.com/invite/b/XNU5ZFKI/1feb44d1c647393ad4673a9a011003e8/simsukraine2022,6,2022-05-04 15:03:21,2022-07-02 12:55:21
5,Costa Rica Tropical Cyclone,Active,FL-2022-000245-CRI,6049,51,NULL,"After an alert was released requesting support from SIMS, Geneva activated the team on 2022-07-01.",C0353KEK13L,,,4,2022-07-01 14:09:05,2022-07-12 16:18:52
6,Heavy India Floods,Active,,1134,84,NULL,"Did some stuff, and then we mapped.",,,,12,2022-07-01 15:47:29,2022-07-01 16:46:35
7,Iraq Cholera Outbreak,Active,EP-2022-000245-IRQ,6037,87,NULL,"Iraq RC requested some support, and IFRC Geneva approved activation of SIMS.",C0353KEK13L,,,1,2022-07-01 17:47:51,2022-07-01 17:49:08
8,Democratic Republic of Congo Hunger Crisis,Active,12341234,6068,187,NULL,We were requested to provide support remotely for the preparation for the lean season in 2022.,,,,20,2022-07-12 16:17:47,NULL
